{
  "schemaVersion": 1,
  "id": "external.f584d3041353f598",
  "kind": "external-embed",
  "title": "https://cdn.jsdelivr.net/gh/Creeper5261/picbed@main/pdf/Latex/Latex_beginner5.pdf",
  "status": "archived",
  "provider": "source-media",
  "url": "https://cdn.jsdelivr.net/gh/Creeper5261/picbed@main/pdf/Latex/Latex_beginner5.pdf",
  "source": "source/_posts/LaTex-Beginner-Manual.md#resource-6"
}
