{
  "schemaVersion": 1,
  "id": "external.b6de9d51f6f65b93",
  "kind": "external-embed",
  "title": "https://blog.csdn.net/u013733326/article/details/79639509",
  "status": "archived",
  "provider": "source-link",
  "url": "https://blog.csdn.net/u013733326/article/details/79639509",
  "source": "source/_posts/Logistic回归.md#resource-0"
}
