{
  "schemaVersion": 1,
  "id": "media.752bec56764a61f6",
  "kind": "media",
  "title": "test_acc.jpg",
  "status": "archived",
  "asset": {
    "path": "../../assets/migrated/temp_classify/1dcnns/test_acc.jpg",
    "alt": "ClassificationSummary",
    "rights": "source asset; provenance retained in source field"
  },
  "source": "source/temp_classify/1dcnns/test_acc.jpg"
}
