{
  "schemaVersion": 1,
  "id": "external.8b09fd0ba9c70e58",
  "kind": "external-embed",
  "title": "https://cdn.jsdelivr.net/gh/Creeper5261/picbed@main/img/cover/106096441_p7.webp",
  "status": "archived",
  "provider": "source-media",
  "url": "https://cdn.jsdelivr.net/gh/Creeper5261/picbed@main/img/cover/106096441_p7.webp",
  "source": "source/_posts/Logistic回归.md#resource-1"
}
