{
  "schemaVersion": 1,
  "id": "media.4218466f1234c00e",
  "kind": "media",
  "title": "108058560_p0.png",
  "status": "archived",
  "asset": {
    "path": "../../assets/migrated/img/cover2/108058560_p0.png",
    "alt": "108058560_p0.png",
    "rights": "source asset; provenance retained in source field"
  },
  "source": "source/img/cover2/108058560_p0.png"
}
