{
  "schemaVersion": 1,
  "id": "external.77ce7d644caa2704",
  "kind": "external-embed",
  "title": "https://cdn.jsdelivr.net/gh/Creeper5261/picbed@main/img/cover/75509590_p5.webp",
  "status": "archived",
  "provider": "source-media",
  "url": "https://cdn.jsdelivr.net/gh/Creeper5261/picbed@main/img/cover/75509590_p5.webp",
  "source": "source/_posts/记录.md#resource-0"
}
