{
  "schemaVersion": 1,
  "id": "external.6bc77aa3fddcda17",
  "kind": "external-embed",
  "title": "https://d33wubrfki0l68.cloudfront.net/6657ba50e702d84afb32fe846bed54fba1a77add/827ae/logo.svg",
  "status": "archived",
  "provider": "source-media",
  "url": "https://d33wubrfki0l68.cloudfront.net/6657ba50e702d84afb32fe846bed54fba1a77add/827ae/logo.svg",
  "source": "source/link/index.md#resource-0"
}
