{
  "schemaVersion": 1,
  "id": "external.3c0fe2f8c303854a",
  "kind": "external-embed",
  "title": "https://cdn.jsdelivr.net/gh/Creeper5261/picbed@main/img/arc/10.36.webp",
  "status": "archived",
  "provider": "source-media",
  "url": "https://cdn.jsdelivr.net/gh/Creeper5261/picbed@main/img/arc/10.36.webp",
  "source": "source/_posts/Arcaea的飞升之路.md#resource-8"
}
