{
  "schemaVersion": 1,
  "id": "media.e15e5177e4d92178",
  "kind": "media",
  "title": "interlude_46.png",
  "status": "archived",
  "asset": {
    "path": "../../assets/migrated/img/cover/interlude_46.png",
    "alt": "interlude_46.png",
    "rights": "source asset; provenance retained in source field"
  },
  "source": "source/img/cover/interlude_46.png"
}
