{
  "schemaVersion": 1,
  "id": "site.hybrid-indexing.timeline",
  "kind": "timeline",
  "title": "混合索引实现时间线",
  "status": "evergreen",
  "publishedAt": "2026-08-02",
  "updatedAt": "2026-08-02",
  "entries": [
    { "at": "2026-08-01", "title": "完成混合索引基座", "target": "site.hybrid-indexing.entity" },
    { "at": "2026-08-02", "title": "加入主题关系探索原型", "target": "site.hybrid-indexing.article" }
  ]
}
