{
  "schemaVersion": 1,
  "id": "external.e3428c44c41a6631",
  "kind": "external-embed",
  "title": "https://hexo.io/docs/one-command-deployment.html",
  "status": "archived",
  "provider": "source-link",
  "url": "https://hexo.io/docs/one-command-deployment.html",
  "source": "source/_posts/hello-world.md#resource-7"
}
