{
  "schemaVersion": 1,
  "id": "external.9e872f3ca23cb0cb",
  "kind": "external-embed",
  "title": "https://cdn.jsdelivr.net/gh/Creeper5261/picbed@main/img/cover/75509590_p1.webp",
  "status": "archived",
  "provider": "source-media",
  "url": "https://cdn.jsdelivr.net/gh/Creeper5261/picbed@main/img/cover/75509590_p1.webp",
  "source": "source/_posts/Arcaea的飞升之路.md#resource-11"
}
