{
  "schemaVersion": 1,
  "id": "external.d6521e4f2a92924a",
  "kind": "external-embed",
  "title": "https://cdn.jsdelivr.net/gh/Creeper5261/picbed@main/img/108005337_p0.webp",
  "status": "archived",
  "provider": "source-media",
  "url": "https://cdn.jsdelivr.net/gh/Creeper5261/picbed@main/img/108005337_p0.webp",
  "source": "source/_posts/VSCode-Linux-Windows-Configurations.md#resource-0"
}
