{
  "schemaVersion": 1,
  "id": "article.4a29ad41bdc1517a",
  "kind": "article",
  "title": "音乐",
  "status": "archived",
  "body": "",
  "source": "source/music/index.md",
  "media": [],
  "relations": [
    {
      "type": "references",
      "target": "external.9e872f3ca23cb0cb"
    }
  ],
  "publishedAt": "2023-05-15T10:26:19.000Z",
  "updatedAt": "2023-05-17T01:07:06.191Z"
}
