{
  "schemaVersion": 1,
  "id": "external.948491ada34f5075",
  "kind": "external-embed",
  "title": "https://www.bilibili.com/video/BV15x411j7k6/",
  "status": "archived",
  "provider": "source-video",
  "url": "https://www.bilibili.com/video/BV15x411j7k6/",
  "source": "source/_posts/LaTex-Beginner-Manual.md#resource-11"
}
