{
  "schemaVersion": 1,
  "id": "article.85daa21d1d225dba",
  "kind": "article",
  "title": "电影",
  "status": "archived",
  "body": "",
  "source": "source/movie/index.md",
  "media": [],
  "relations": [
    {
      "type": "references",
      "target": "external.9e872f3ca23cb0cb"
    }
  ],
  "publishedAt": "2023-05-15T10:26:19.000Z",
  "updatedAt": "2023-05-17T01:07:24.390Z"
}
